Image_Url, Item_Name, Item_Price, Average_Rating, Number_Of_Ratings
https://m.media-amazon.com/images/I/61QvFYU1vfS._AC_UL320_.jpg,Becoming a Data Head: How to Think| Speak| and Understand Data Science| Statistics| and Machine Learning,S$33.97,4.7 ,29
https://m.media-amazon.com/images/I/61q1IqrlhyL._AC_UL320_.jpg,Ace the Data Science Interview: 201 Real Interview Questions Asked By FAANG| Tech Startups| & Wall Street,S$49.96,4.6 ,229
https://m.media-amazon.com/images/I/81SCVWF4A1L._AC_UL320_.jpg,Data Science from Scratch: First Principles with Python,S$48.29,4.5 ,375
https://m.media-amazon.com/images/I/91Yqv5wWuPL._AC_UL320_.jpg,Python Data Science Handbook: Essential Tools for Working with Data,S$39.25,4.5 ,439
https://m.media-amazon.com/images/I/81tyuOUHPNL._AC_UL320_.jpg,Data Science for Business: What You Need to Know about Data Mining and Data-Analytic Thinking,S$51.91,4.5 ,580
https://m.media-amazon.com/images/I/81jwM5Wq8zL._AC_UL320_.jpg,Data Smart: Using Data Science to Transform Information into Insight,S$46.52,4.5 ,217
https://m.media-amazon.com/images/I/81k33dFBLtS._AC_UL320_.jpg,Data Science on AWS: Implementing End-to-End| Continuous AI and Machine Learning Pipelines,S$50.48,4.4 ,42
https://m.media-amazon.com/images/I/81YPoJkJafS._AC_UL320_.jpg,R for Data Science: Import| Tidy| Transform| Visualize| and Model Data,S$55.70,4.7 ,981
https://m.media-amazon.com/images/I/81qw9uLMlNL._AC_UL320_.jpg,Data Mesh: Delivering Data-Driven Value at Scale,S$86.21,,
https://m.media-amazon.com/images/I/91m1qz7cHqL._AC_UL320_.jpg,Data Science at the Command Line: Obtain| Scrub| Explore| and Model Data with Unix Power Tools,S$53.66,4.1 ,4
https://m.media-amazon.com/images/I/51o1-zE+y3L._AC_UL320_.jpg,Product Analytics: Applied Data Science Techniques for Actionable Consumer Insights,S$53.66,,
https://m.media-amazon.com/images/I/61TxA9Et5aL._AC_UL320_.jpg,Machine Learning in Business: An Introduction to the World of Data Science,S$39.99,5.0 ,4
https://m.media-amazon.com/images/I/81cP2wg48dL._AC_UL320_.jpg,Statistical Foundations of Data Science,S$182.01,4.5 ,2
https://m.media-amazon.com/images/I/51emTP8OoBS._AC_UL320_.jpg,Computer Age Statistical Inference| Student Edition: Algorithms| Evidence| and Data Science: 6,S$51.99,4.6 ,3
https://m.media-amazon.com/images/I/510Chv7zSoL._AC_UL320_.jpg,Fraud Analytics Using Descriptive| Predictive| and Social Network Techniques: A Guide to Data Science for Fraud Detection,S$54.28,3.9 ,36
https://m.media-amazon.com/images/I/71E7pMR-SPL._AC_UL320_.jpg,Storytelling with Data: A Data Visualization Guide for Business Professionals,S$40.48,4.6 ,1'782
https://m.media-amazon.com/images/I/61oFWc-pfwL._AC_UL320_.jpg,Trader Construction Kit: Fundamental & Technical Analysis| Risk Management| Directional Trading| Spreads| Options| Quantitative Strategies| Execution| Position Management| Data Science & Programming,S$149.00,4.6 ,50
https://m.media-amazon.com/images/I/61neNbg2g5L._AC_UL320_.jpg,Machine Learning Algorithms: Popular algorithms for data science and machine learning| 2nd Edition,S$99.12,4.5 ,4
https://m.media-amazon.com/images/I/91Fk4bhoI9L._AC_UL320_.jpg,Data Science Programming All-in-One For Dummies,S$42.15,4.8 ,28
https://m.media-amazon.com/images/I/61f8enOTzwL._AC_UL320_.jpg,Data Science For Dummies,S$37.77,4.6 ,6
https://m.media-amazon.com/images/I/516nl0MWn9L._AC_UL320_.jpg,Business Data Science: Combining Machine Learning and Economics to Optimize| Automate| and Accelerate Business Decisions,S$45.37,4.4 ,95
https://m.media-amazon.com/images/I/81uJblAQ7bL._AC_UL320_.jpg,Driving Digital Transformation through Data and AI: A Practical Guide to Delivering Data Science and Machine Learning Products,S$53.46,5.0 ,2
https://m.media-amazon.com/images/I/61jbKkHWfVL._AC_UL320_.jpg,The The Python Workshop: Learn to code in Python and kickstart your career in software development or data science,S$57.47,4.5 ,125
https://m.media-amazon.com/images/I/41P4cxyGIHL._AC_UL320_.jpg,The Book of Why: The New Science of Cause and Effect,S$18.71,4.5 ,838
https://m.media-amazon.com/images/I/71ofO1yuNML._AC_UL320_.jpg,Data Visualisation: A Handbook for Data Driven Design,S$60.46,4.4 ,114
https://m.media-amazon.com/images/I/61245SvUfJL._AC_UL320_.jpg,Python for Data Science: 2 Books in 1: The Ultimate Step-By-Step Amateur's Exercise to Master Data Science| Machine Learning| and Analysis by Using Python. (Part 1 and 2),S$7.79,,
https://m.media-amazon.com/images/I/61UqmXc2LcL._AC_UL320_.jpg,Naked Statistics: Stripping the Dread from the Data,S$15.97,4.6 ,1'194
https://m.media-amazon.com/images/I/811venbt3TL._AC_UL320_.jpg,Data Science For Dummies,S$32.50,4.5 ,122
https://m.media-amazon.com/images/I/61hpSpM3BIL._AC_UL320_.jpg,Data Science: The Complete Guide To Data Science For Beginners,S$20.65,,
https://m.media-amazon.com/images/I/81DV9mvQsML._AC_UL320_.jpg,Doing Data Science,S$60.30,4.4 ,89
https://m.media-amazon.com/images/I/41kDT9HOB6L._AC_UL320_.jpg,Numsense! Data Science for the Layman: No Math Added,S$18.60,4.7 ,52
https://m.media-amazon.com/images/I/61VY+AICCNL._AC_UL320_.jpg,Data Strategy: How to Profit from a World of Big Data| Analytics and Artificial Intelligence,S$34.42,3.7 ,3
https://m.media-amazon.com/images/I/61TnHhFvrDL._AC_UL320_.jpg,Data Engineering with AWS: Learn how to design and build cloud-based data transformation pipelines using AWS,S$68.88,4.8 ,6
https://m.media-amazon.com/images/I/41QUEePTWPL._AC_UL320_.jpg,Data Management at Scale: Best Practices for Enterprise Architecture,S$74.54,4.6 ,29
https://m.media-amazon.com/images/I/416mpb4vVqL._AC_UL320_.jpg,Data Science: Simple and Effective Tips and Tricks to Learn Data Science,S$34.68,4.5 ,4
https://m.media-amazon.com/images/I/41GfVFXxViL._AC_UL320_.jpg,Intro to Python for Computer Science and Data Science: Learning to Program with AI| Big Data and The Cloud,S$108.97,4.7 ,184
https://m.media-amazon.com/images/I/51dn5xBtrQL._AC_UL320_.jpg,Cybersecurity Data Science: Best Practices in an Emerging Profession,S$206.91,,
https://m.media-amazon.com/images/I/61ZHxtIVRTL._AC_UL320_.jpg,Cracking the Data Science Interview: 101+ Data Science Questions & Solutions,S$20.82,3.9 ,21
https://m.media-amazon.com/images/I/81dHL7pFWPL._AC_UL320_.jpg,Machine Learning and Data Science Blueprints for Finance: From Building Trading Strategies to Robo-Advisors Using Python,S$69.84,4.0 ,24
https://m.media-amazon.com/images/I/61zVrRHFVDL._AC_UL320_.jpg,Data Or It Didn't Happen: Dot Grid Page Notebook Gift For Computer Data Science Related People.,S$26.99,,
https://m.media-amazon.com/images/I/61E9Wn1sUgL._AC_UL320_.jpg,Data Nerd: Dot Grid Page Notebook Gift For Computer Data Science Related People.,S$35.57,,
https://m.media-amazon.com/images/I/813l1BZ7PbL._AC_UL320_.jpg,Communicating with Data: Making Your Case with Data,S$67.73,4.5 ,2
https://m.media-amazon.com/images/I/71ibtC-lA+L._AC_UL320_.jpg,Probabilistic Machine Learning: An Introduction,S$135.50,4.4 ,7
https://m.media-amazon.com/images/I/61qCizTU3+L._AC_UL320_.jpg,The Decision Maker's Handbook to Data Science: A Guide for Non-Technical Executives| Managers| and Founders,S$43.82,4.4 ,4
https://m.media-amazon.com/images/I/51x4Ms2DjTL._AC_UL320_.jpg,Data Analytics for Organisational Development: Unleashing the Potential of Your Data,S$43.70,5.0 ,3
https://m.media-amazon.com/images/I/61hh6-cbJFL._AC_UL320_.jpg,Extending Power BI with Python and R: Ingest| transform| enrich| and visualize data using the power of analytical languages,S$68.42,5.0 ,3
https://m.media-amazon.com/images/I/71xatzomvdL._AC_UL320_.jpg,Data Science for Supply Chain Forecasting,S$54.16,4.9 ,14
https://m.media-amazon.com/images/I/81O+YkUG1aL._AC_UL320_.jpg,Foundations of Data Science,S$67.32,4.9 ,28
https://m.media-amazon.com/images/I/51VqQF1JtKL._AC_UL320_.jpg,Data is Life: Dot Grid Page Notebook Gift For Computer Data Science Related People.,S$26.99,,
https://m.media-amazon.com/images/I/61FLzOfx58L._AC_UL320_.jpg,Data Is My Jam: Dot Grid Page Notebook Gift For Computer Data Science Related People.,S$26.99,,
https://m.media-amazon.com/images/I/51OmGxSvrxL._AC_UL320_.jpg,Data Legend: Dot Grid Page Notebook Gift For Computer Data Science Related People.,S$26.81,,
https://m.media-amazon.com/images/I/61Zje7+s7vL._AC_UL320_.jpg,Data Heals The Soul: Dot Grid Page Notebook Gift For Computer Data Science Related People.,S$26.99,,
https://m.media-amazon.com/images/I/51YMNKLqanL._AC_UL320_.jpg,Data And Coffee: Dot Grid Page Notebook Gift For Computer Data Science Related People.,S$26.99,,
https://m.media-amazon.com/images/I/51XTTPXuySL._AC_UL320_.jpg,Big Data Demystified: How to use big data| data science and AI to make better business decisions and gain competitive advantage,S$10.60,4.3 ,24
https://m.media-amazon.com/images/I/81Sdk02bg+L._AC_UL320_.jpg,Practical Statistics for Data Scientists: 50+ Essential Concepts Using R and Python,S$57.95,4.5 ,283
https://m.media-amazon.com/images/I/71+a2BRg5YL._AC_UL320_.jpg,Deep Learning: A Visual Approach,S$105.65,4.7 ,18
https://m.media-amazon.com/images/I/818jBhZPuUL._AC_UL320_.jpg,Data Mining for Business Analytics: Concepts| Techniques and Applications in Python,S$145.00,4.3 ,31
https://m.media-amazon.com/images/I/813T2iWhVVL._AC_UL320_.jpg,Kafka - The Definitive Guide: Real-Time Data and Stream Processing at Scale,S$54.05,4.8 ,14
https://m.media-amazon.com/images/I/41nvjoBWxhL._AC_UL320_.jpg,Effective Data Storytelling: How to Drive Change with Data| Narrative and Visuals,S$48.31,4.7 ,97
https://m.media-amazon.com/images/I/8145y9-jhYL._AC_UL320_.jpg,The Big Book of Dashboards: Visualizing Your Data Using Real-World Business Scenarios,S$53.90,4.6 ,426
https://m.media-amazon.com/images/I/616ugoD9VYL._AC_UL320_.jpg,The Data Book: Collection and Management of Research Data,S$76.97,5.0 ,3
https://m.media-amazon.com/images/I/71QE7OW-WCS._AC_UL320_.jpg,Data Science for Beginners: A Comprehensive Guide to Essentials and Principles of Data Science,S$39.98,,
https://m.media-amazon.com/images/I/71JVukj1xzS._AC_UL320_.jpg,Data Visualization and Data Analysis: The Ultimate 2021 Guide to Learn Machine Learning| Predictive Analysis| and Foundational Data Science Technologies.,S$5.99,,
https://m.media-amazon.com/images/I/61VAEfXDsGL._AC_UL320_.jpg,Heard In Data Science Interviews: Over 650 Most Commonly Asked Interview Questions & Answers,S$70.65,3.2 ,41
https://m.media-amazon.com/images/I/61Dugxq3rdL._AC_UL320_.jpg,Data Science Manager Notebook| Professional Journal| Office Writing Notebook| Daily Notes & Action Items Notebook| 140 pages| 8.5” x 11”| Glossy cover,S$24.98,,
https://m.media-amazon.com/images/I/61Yj7Q7kMKL._AC_UL320_.jpg,Data Science Lead (Product Analytics) Notebook| Professional Journal| Office Writing Notebook| Daily Notes & Action Items Notebook| 140 pages| 8.5” x 11”| Glossy cover,S$24.98,,
https://m.media-amazon.com/images/I/81ppbsqIVCL._AC_UL320_.jpg,Data Science Para Leigos,S$86.20,4.5 ,27
https://m.media-amazon.com/images/I/61qn0sroQFL._AC_UL320_.jpg,Data Science Para Negócios. O que Você Precisa Saber Sobre Mineração de Dados e Pensamento Analítico de Dados,S$77.31,4.7 ,449
https://m.media-amazon.com/images/I/613vbmQCwFL._AC_UL320_.jpg,Data Visualization with Excel Dashboards and Reports,S$41.55,4.2 ,23
https://m.media-amazon.com/images/I/611LSmsnR2S._AC_UL320_.jpg,The Data Warehouse Toolkit: The Definitive Guide to Dimensional Modeling,S$59.64,4.6 ,294
https://m.media-amazon.com/images/I/71zsG4kur9L._AC_UL320_.jpg,Computer Science Distilled: Learn the Art of Solving Computational Problems,S$42.02,4.4 ,495
https://m.media-amazon.com/images/I/81JmcxbkmuL._AC_UL320_.jpg,Better Data Visualizations: A Guide for Scholars| Researchers| and Wonks,S$47.35,4.4 ,96
https://m.media-amazon.com/images/I/718CFM7MFgL._AC_UL320_.jpg,Introduction to Computation and Programming Using Python| third edition: With Application to Computational Modeling and Understanding Data,S$65.00,4.6 ,41
https://m.media-amazon.com/images/I/81YHoGwzyvL._AC_UL320_.jpg,Bayesian Data Analysis,S$129.86,4.7 ,159
https://m.media-amazon.com/images/I/71nFmD4JdDL._AC_UL320_.jpg,Data Science From Scratch: The #1 Data Science Guide For Everything A Data Scientist Needs To Know: Python| Linear Algebra| Statistics| Coding| Applications| Neural Networks| And Decision Trees,S$36.69,3.2 ,7
https://m.media-amazon.com/images/I/71KKX+pBFYL._AC_UL320_.jpg,Data Pipelines with Apache Airflow,S$63.83,4.8 ,12
https://m.media-amazon.com/images/I/519M8D8yXNL._AC_UL320_.jpg,Show me the Data: Note Book for Data Collection- Gifts for ABA Therapist| Statisticians| Data Analysts| Scientists| Mathematicians| BCBA|110 page ... Journal 6" x 9": Lined notebook/gift journal,S$12.40,,
https://m.media-amazon.com/images/I/71g9FxeEprL._AC_UL320_.jpg,Build A Career in Data Science,S$57.86,4.7 ,44
https://m.media-amazon.com/images/I/61uRpcdPhNL._AC_UL320_.jpg,Introduction to Algorithms,S$79.44,4.4 ,1'484
https://m.media-amazon.com/images/I/61Fy0RW19GL._AC_UL320_.jpg,Cleaning Data for Effective Data Science: Doing the other 80% of the work with Python| R| and command-line tools,S$55.59,4.6 ,6
https://m.media-amazon.com/images/I/51kEV9eK2FL._AC_UL320_.jpg,Data Science: The Executive Summary - A Technical Book for Non-Technical Professionals,S$94.23,,
https://m.media-amazon.com/images/I/714Q9WDBk9L._AC_UL320_.jpg,Data Pipelines Pocket Reference: Moving and Processing Data for Analytics,S$29.17,4.6 ,50
https://m.media-amazon.com/images/I/61nR4w8iITL._AC_UL320_.jpg,There Are Two Types Of People In The World Those Who Can Extrapolate From Incomplete Data: Computer Data Science Gift For Scientist,S$14.46,,
https://m.media-amazon.com/images/I/61pcvCicGNL._AC_UL320_.jpg,There Are Two Types Of People In The World Those Who Can Extrapolate From Incomplete Data: Computer Data Science Gift For Scientist,S$14.32,,
https://m.media-amazon.com/images/I/517uvbXhm6L._AC_UL320_.jpg,There Are Two Types Of People In The World Those Who Can Extrapolate From Incomplete Data: Computer Data Science Gift For Scientist,S$14.45,,
https://m.media-amazon.com/images/I/514heSESAJL._AC_UL320_.jpg,There Are Two Types Of People In The World Those Who Can Extrapolate From Incomplete Data: Computer Data Science Gift For Scientist,S$14.45,,
https://m.media-amazon.com/images/I/51ZuD9nMhqL._AC_UL320_.jpg,There Are Two Types Of People In The World Those Who Can Extrapolate From Incomplete Data: Computer Data Science Gift For Scientist,S$14.46,,
https://m.media-amazon.com/images/I/61miPP9LCDL._AC_UL320_.jpg,There Are Two Types Of People In The World Those Who Can Extrapolate From Incomplete Data: Computer Data Science Gift For Scientist,S$14.45,,
https://m.media-amazon.com/images/I/51PGdFWYHoL._AC_UL320_.jpg,There Are Two Types Of People In The World Those Who Can Extrapolate From Incomplete Data: Computer Data Science Gift For Scientist,S$14.45,,
https://m.media-amazon.com/images/I/51JBg3GpRSL._AC_UL320_.jpg,There Are Two Types Of People In The World Those Who Can Extrapolate From Incomplete Data: Computer Data Science Gift For Scientist,S$14.46,,
https://m.media-amazon.com/images/I/51Cdhw7PxxL._AC_UL320_.jpg,There Are Two Types Of People In The World Those Who Can Extrapolate From Incomplete Data: Computer Data Science Gift For Scientist,S$14.45,,
https://m.media-amazon.com/images/I/81zeooot0EL._AC_UL320_.jpg,Modern Data Science with R,S$117.58,3.8 ,7
https://m.media-amazon.com/images/I/81R5BmGtv-L._AC_UL320_.jpg,Hands-on Machine Learning with Scikit-Learn| Keras| and TensorFlow: Concepts| Tools| and Techniques to Build Intelligent Systems,S$52.46,4.7 ,2'144
https://m.media-amazon.com/images/I/61t-NzTMvUL._AC_UL320_.jpg,What I Need Today Is Lots Lots Of Data: Dot Grid Page Notebook Gift For Computer Data Science Related People.,S$16.52,,
https://m.media-amazon.com/images/I/51BRPRZa5aL._AC_UL320_.jpg,There Are Two Types Of People In The World Those Who Can Extrapolate From Incomplete Data: Computer Data Science Gift For Scientist,S$14.46,,
https://m.media-amazon.com/images/I/41m4zC62AeL._AC_UL320_.jpg,The basics rstudio for data science: Start Writing Code to Wrangle| Analyze| and Visualize Data with Rstudio,S$29.78,4.0 ,2
https://m.media-amazon.com/images/I/51Cdhw7PxxL._AC_UL320_.jpg,There Are Two Types Of People In The World Those Who Can Extrapolate From Incomplete Data: Computer Data Science Gift For Scientist,S$14.45,,
https://m.media-amazon.com/images/I/81zeooot0EL._AC_UL320_.jpg,Modern Data Science with R,S$117.58,3.8 ,7
https://m.media-amazon.com/images/I/81R5BmGtv-L._AC_UL320_.jpg,Hands-on Machine Learning with Scikit-Learn| Keras| and TensorFlow: Concepts| Tools| and Techniques to Build Intelligent Systems,S$52.46,4.7 ,2'144
https://m.media-amazon.com/images/I/61t-NzTMvUL._AC_UL320_.jpg,What I Need Today Is Lots Lots Of Data: Dot Grid Page Notebook Gift For Computer Data Science Related People.,S$16.52,,
https://m.media-amazon.com/images/I/51BRPRZa5aL._AC_UL320_.jpg,There Are Two Types Of People In The World Those Who Can Extrapolate From Incomplete Data: Computer Data Science Gift For Scientist,S$14.46,,
https://m.media-amazon.com/images/I/41m4zC62AeL._AC_UL320_.jpg,The basics rstudio for data science: Start Writing Code to Wrangle| Analyze| and Visualize Data with Rstudio,S$29.78,4.0 ,2
https://m.media-amazon.com/images/I/91lrhlw-XcL._AC_UL320_.jpg,Python for Data Analysis| 2e: Data Wrangling with Pandas| Numpy| and Ipython,S$63.61,4.6 ,1'041
https://m.media-amazon.com/images/I/51Ht63qpkeL._AC_UL320_.jpg,Data Science on the Google Cloud Platform: Implementing End-To-End Real-Time Data Pipelines: From Ingest to Machine Learning,S$95.79,,
https://m.media-amazon.com/images/I/81GZzXczt1L._AC_UL320_.jpg,Weapons of Math Destruction: How Big Data Increases Inequality and Threatens Democracy,S$20.24,4.5 ,1'504
https://m.media-amazon.com/images/I/61PJj4c1RJL._AC_UL320_.jpg,Data Science Graduate Guru Notebook: Customized 100 Page Lined Journal Gift For A Busy Data Science Graduate,S$14.45,,
https://m.media-amazon.com/images/I/41o2k78BtxL._AC_UL320_.jpg,Data Mining with R: Learning with Case Studies| Second Edition,S$140.68,4.6 ,6
https://m.media-amazon.com/images/I/512Xq9XziWL._AC_UL320_.jpg,Data King: Computer Data Science Gift For Scientist (120 Page Journal Notebook),S$14.45,,
https://m.media-amazon.com/images/I/51J-Bg3BIQL._AC_UL320_.jpg,Data Queen: Computer Data Science Gift For Scientist (120 Page Journal Notebook),S$14.45,,
https://m.media-amazon.com/images/I/61CnR5gGSwS._AC_UL320_.jpg,Graph Machine Learning: Take graph data to the next level by applying machine learning techniques and algorithms,S$71.35,4.0 ,12
https://m.media-amazon.com/images/I/81HCD7AkTKL._AC_UL320_.jpg,Practical SQL| 2nd Edition: A Beginner's Guide to Storytelling with Data,S$49.35,5.0 ,8
https://m.media-amazon.com/images/I/71r4imMDTbL._AC_UL320_.jpg,Machine Learning for Algorithmic Trading: Predictive models to extract signals from market and alternative data for systematic trading strategies with Python| 2nd Edition,S$75.16,4.4 ,116
https://m.media-amazon.com/images/I/71SaKd5egWL._AC_UL320_.jpg,There Are Two Types of People in the World Those Who Can Extrapolate from Incomplete Data: Computer Data Science Gift For Scientist Dot Grid Notebook,S$14.45,,
https://m.media-amazon.com/images/I/61e3hcTh1eS._AC_UL320_.jpg,Data Science for Beginners: The Ultimate Guide to Data Analysis| Data Science| Python Machine Learning| and Big Data,S$6.68,,
https://m.media-amazon.com/images/I/71OjrxdHA-L._AC_UL320_.jpg,Data Analytics Made Easy: Analyze and present data to make informed decisions without writing any code,S$51.52,4.7 ,4
https://m.media-amazon.com/images/I/51VqQF1JtKL._AC_UL320_.jpg,Data is Life: Blanked Lined Journal Gift For Computer Data Science Related People.,S$26.81,,
https://m.media-amazon.com/images/I/61zVrRHFVDL._AC_UL320_.jpg,Data Or It Didn't Happen: Blanked Lined Journal Gift For Computer Data Science Related People.,S$16.41,,
https://m.media-amazon.com/images/I/61E9Wn1sUgL._AC_UL320_.jpg,Data Nerd: Blanked Lined Journal Gift For Computer Data Science Related People.,S$26.99,,
https://m.media-amazon.com/images/I/51OmGxSvrxL._AC_UL320_.jpg,Data Legend: Blanked Lined Journal Gift For Computer Data Science Related People.,S$26.99,,
https://m.media-amazon.com/images/I/61FLzOfx58L._AC_UL320_.jpg,Data-Is My Jam: Blanked Lined Journal Gift For Computer Data Science Related People.,S$26.81,,
https://m.media-amazon.com/images/I/51YMNKLqanL._AC_UL320_.jpg,Data And Coffee: Blanked Lined Journal Gift For Computer Data Science Related People.,S$27.01,,
https://m.media-amazon.com/images/I/71+jJA6RzwL._AC_UL320_.jpg,Big Data: Information in the Digital World with Science Activities for Kids,S$39.52,4.4 ,4
https://m.media-amazon.com/images/I/81XFHAihaaL._AC_UL320_.jpg,Data Science: Theory| Analysis and Applications,S$136.98,,
https://m.media-amazon.com/images/I/71pG+xSGy-L._AC_UL320_.jpg,Data Science: Concepts and Practice,S$87.29,4.6 ,6
https://m.media-amazon.com/images/I/81xkjj+FAfL._AC_UL320_.jpg,Learning SQL: Generate| Manipulate| and Retrieve Data,S$45.18,4.6 ,166
https://m.media-amazon.com/images/I/61iBvWAOjxL._AC_UL320_.jpg,The Chief Data Officer Handbook for Data Governance,S$29.16,4.2 ,48
https://m.media-amazon.com/images/I/614Bn8NS+eL._AC_UL320_.jpg,Data Science Leader Guru Notebook: Customized 100 Page Lined Journal Gift For A Busy Data Science Leader,S$14.36,,
https://m.media-amazon.com/images/I/61A5vqpA4OL._AC_UL320_.jpg,Data Science Analyst Guru Notebook: Customized 100 Page Lined Journal Gift For A Busy Data Science Analyst,S$14.45,,
https://m.media-amazon.com/images/I/61WqLpyZCxL._AC_UL320_.jpg,Data Science Developer Guru Notebook: Customized 100 Page Lined Journal Gift For A Busy Data Science Developer,S$14.45,,
https://m.media-amazon.com/images/I/61lEJM0l+7L._AC_UL320_.jpg,Data Science Manager Guru Notebook: Customized 100 Page Lined Journal Gift For A Busy Data Science Manager,S$14.45,,
https://m.media-amazon.com/images/I/6172C4R8hlL._AC_UL320_.jpg,Data Science Consultant Guru Notebook: Customized 100 Page Lined Journal Gift For A Busy Data Science Consultant,S$14.45,,
https://m.media-amazon.com/images/I/61vP5wRIGfL._AC_UL320_.jpg,Data Science Engineer Guru Notebook: Customized 100 Page Lined Journal Gift For A Busy Data Science Engineer,S$14.46,,
https://m.media-amazon.com/images/I/61VelM-kDsL._AC_UL320_.jpg,Data Science Director Guru Notebook: Customized 100 Page Lined Journal Gift For A Busy Data Science Director,S$14.45,,
https://m.media-amazon.com/images/I/61l1P6Y6ggL._AC_UL320_.jpg,Data Science Expert Guru Notebook: Customized 100 Page Lined Journal Gift For A Busy Data Science Expert,S$14.45,,
https://m.media-amazon.com/images/I/61gOlLy4BXS._AC_UL320_.jpg,Statistics for the Trading Floor: Data Science for Investing,S$40.07,4.0 ,41
https://m.media-amazon.com/images/I/61JqnlxLEoL._AC_UL320_.jpg,Yes I Really Do Need All These Data: Dot Grid Page Notebook Gift For Computer Data Science Related People.,S$16.52,,
https://m.media-amazon.com/images/I/51Zx-tapEhL._AC_UL320_.jpg,Wait I See Data: Dot Grid Page Notebook Gift For Computer Data Science Related People.,S$16.41,,
https://m.media-amazon.com/images/I/61LspJD9QjL._AC_UL320_.jpg,What Can I Say I Like Data: Dot Grid Page Notebook Gift For Computer Data Science Related People.,S$16.52,,
https://m.media-amazon.com/images/I/618k86xdWpL._AC_UL320_.jpg,There Are Two Types Of People Those Who Can Extrapolate-From Incomplete Data: Dot Grid Page Notebook Gift For Computer Data Science Related People.,S$16.52,,
https://m.media-amazon.com/images/I/614P0NGToSL._AC_UL320_.jpg,There Are Two Types Of People Those Who Can Extrapolate-From Incomplete Data: Dot Grid Page Notebook Gift For Computer Data Science Related People.,S$16.41,,
https://m.media-amazon.com/images/I/61wgCKLczyL._AC_UL320_.jpg,Peace Love Lots Lots Of Data: Dot Grid Page Notebook Gift For Computer Data Science Related People.,S$16.52,,
https://m.media-amazon.com/images/I/51RLrumiszL._AC_UL320_.jpg,Life Would Be Boring Without Data: Dot Grid Page Notebook Gift For Computer Data Science Related People.,S$16.52,,
https://m.media-amazon.com/images/I/61pL9P1x0YL._AC_UL320_.jpg,Its Always Time To Think About Data: Dot Grid Page Notebook Gift For Computer Data Science Related People.,S$16.52,,
https://m.media-amazon.com/images/I/61ZMuTBiyHL._AC_UL320_.jpg,Introverted But WillingTo Discuss Data: Dot Grid Page Notebook Gift For Computer Data Science Related People.,S$16.44,,
https://m.media-amazon.com/images/I/618k86xdWpL._AC_UL320_.jpg,There Are Two Types Of People Those Who Can Extrapolate-From Incomplete Data: Dot Grid Page Notebook Gift For Computer Data Science Related People.,S$16.52,,
https://m.media-amazon.com/images/I/614P0NGToSL._AC_UL320_.jpg,There Are Two Types Of People Those Who Can Extrapolate-From Incomplete Data: Dot Grid Page Notebook Gift For Computer Data Science Related People.,S$16.41,,
https://m.media-amazon.com/images/I/61wgCKLczyL._AC_UL320_.jpg,Peace Love Lots Lots Of Data: Dot Grid Page Notebook Gift For Computer Data Science Related People.,S$16.52,,
https://m.media-amazon.com/images/I/51RLrumiszL._AC_UL320_.jpg,Life Would Be Boring Without Data: Dot Grid Page Notebook Gift For Computer Data Science Related People.,S$16.52,,
https://m.media-amazon.com/images/I/61pL9P1x0YL._AC_UL320_.jpg,Its Always Time To Think About Data: Dot Grid Page Notebook Gift For Computer Data Science Related People.,S$16.52,,
https://m.media-amazon.com/images/I/61ZMuTBiyHL._AC_UL320_.jpg,Introverted But WillingTo Discuss Data: Dot Grid Page Notebook Gift For Computer Data Science Related People.,S$16.44,,
https://m.media-amazon.com/images/I/51SYm2SZkGL._AC_UL320_.jpg,Id rather be With My Data: Dot Grid Page Notebook Gift For Computer Data Science Related People.,S$26.81,,
https://m.media-amazon.com/images/I/616FZQFlOnL._AC_UL320_.jpg,Excuse Me While I Think About Data: Dot Grid Page Notebook Gift For Computer Data Science Related People.,S$16.37,,
