Image_Url, Item_Name, Item_Price, Average_Rating (Max Score is 5), Number_Of_Ratings 
https://m.media-amazon.com/images/I/61i6CFTu-RL._AC_UL320_.jpg,Taiko Drum Controller for Nintendo Switch,S$102.00,4.3 ,2'696
https://m.media-amazon.com/images/I/91JY+4F-6iL._AC_UL320_.jpg,Oculus Quest Travel Case,S$82.00,4.7 ,591
https://m.media-amazon.com/images/I/61re4WpIQQL._AC_UL320_.jpg,HyperX Cloud Earbuds Gaming Headphones with Mic for Nintendo Switch and Mobile Gaming (HX-HSCEB-RD),S$52.00,4.1 ,6'149
https://m.media-amazon.com/images/I/41hKeaDVQeL._AC_UL320_.jpg,Professional Gaming Mouse Mat for Windows PC,S$20.92,4.5 ,15
https://m.media-amazon.com/images/I/81kExdr7eIL._AC_UL320_.jpg,Gaming Glasses | Blue Light Blocking Glasses | Razer/Onyx by Gunnar | 65% Blue Light Protection| 100% UV Light| Anti-Reflective To Protect & Reduce Eye Strain & Dryness,S$49.63,4.3 ,22
https://m.media-amazon.com/images/I/71bWQTgQcDL._AC_UL320_.jpg,Collectible Call of Duty WW2 Cable Guy Device Holder - works with PlayStation and Xbox controllers and all Smartphones CGCAPC0001,S$30.74,3.8 ,5
https://m.media-amazon.com/images/I/616QBwAfjDL._AC_UL320_.jpg,Grip-iT Analog Stick Covers,S$9.66,4.2 ,5'449
https://m.media-amazon.com/images/I/71Y9yVKSu6L._AC_UL320_.jpg,Starlink Battle for Atlas PS4 Co-Op Pack| PlayStation 4,S$31.46,4.5 ,84
https://m.media-amazon.com/images/I/71HEULqzadL._AC_UL320_.jpg,Twelve South 12-1302 BackPack for iMac and Apple Displays | Hidden Storage Shelf for Hard Drives and Accessories (silver),S$64.62,4.6 ,1'569
https://m.media-amazon.com/images/I/410wrbm89rL._AC_UL320_.jpg,HASKO accessories - Shower Caddy with Suction Cup - 304 Stainless Steel 2Tier Basket for Bathroom - Rustproof (Chrome),S$79.98,4.3 ,773
https://m.media-amazon.com/images/I/713XdA3arNL._AC_UL320_.jpg,HORI Nintendo Switch Wireless HORIPAD Zelda Edition Rechargeable Controller - Nintendo Switch,S$79.75,4.4 ,471
https://m.media-amazon.com/images/I/51QceI00u2L._AC_UL320_.jpg,Viva Collection AF- Baking accessory,S$35.00,4.6 ,9
https://m.media-amazon.com/images/I/61mLN3J-GeL._AC_UL320_.jpg,Nintendo Joy-Con Strap - Neon Blue,S$33.45,4.6 ,445
https://m.media-amazon.com/images/I/61MKWydeYXL._AC_UL320_.jpg,Surge Switchpad Pro Wireless Controller for Nintendo Switch - Red - Nintendo Switch,S$47.31,4.1 ,195
https://m.media-amazon.com/images/I/61UrznB3gVL._AC_UL320_.jpg,8Bitdo Smartphone Clip for SN30 & SF30 Pro - Android,S$17.40,4.5 ,715
https://m.media-amazon.com/images/I/61jLJ-RXf6L._AC_UL320_.jpg,IQIKU Gamecube Controller Adapter. Super Smash Bros Switch Gamecube Adapter For Wii U| Pc. Support Turbo And Vibration Features. No Driver And No Lag-Gamecube Adapter,S$27.42,4.5 ,4'798
https://m.media-amazon.com/images/I/81HjyDDLEtL._AC_UL320_.jpg,Neewer 50 in 1 Action Camera Accessory Kit Compatible with GoPro Hero10/9/8/7/6/5/4| GoPro Max| GoPro Fusion| Insta360| DJI Osmo Action/Action 2| AKASO| and more,S$42.99,4.4 ,41'386
https://m.media-amazon.com/images/I/71eZUxdmgFL._AC_UL320_.jpg,Bar Fly 4 Max Bicycle Accessory Mount| Black| for Large Computers - Garmin| Wahoo| Polar| Bryton| Cateye| Mio| Joule,S$57.60,4.3 ,106
https://m.media-amazon.com/images/I/8154uAFHH0L._AC_UL320_.jpg,Accessory House Ear Cushions for Bose Quiet Comfort 35 (QC35) Headphones. Complete with QC35 Shaped Scrims with 'L and R' Lettering (QC35 Grey),S$14.99,4.6 ,8'050
https://m.media-amazon.com/images/I/81cKHJw8iEL._AC_UL320_.jpg,NOCO GENIUS NOCO GC008 X-Connect M10 XL Eyelet Terminal Accessory Smart Battery Chargers,S$21.02,4.7 ,12'208
https://m.media-amazon.com/images/I/81omLXuaRyL._AC_UL320_.jpg,ProCase Travel Electronic Accessories Organizer| Case for MacBook Power Adapter Apple Magic Mouse 2 Apple Pencil USB Flash Disk SD Card iPhone iPad Chargers –Black,S$23.99,4.4 ,116
https://m.media-amazon.com/images/I/51Wiy6bZ4KL._AC_UL320_.jpg,ORICO 7 Channel Desk Cable Clips Cable Management Cord Organizer Wire Cord Holder for Power Cords and Charging Accessory Cables| Mouse Cable| PC| Office and Home,S$7.19,4.3 ,6
https://m.media-amazon.com/images/I/61juu-8u-9L._AC_UL320_.jpg,Targus CitySmart Bag for Business Traveler and School Student Supplies Cable/Pencil Case| Internal Organizer Zip Pockets| Fits Tablet and PC Accessory| Black (TXZ02504GL),S$29.60,4.6 ,947
https://m.media-amazon.com/images/I/616T77Vh6kS._AC_UL320_.jpg,Electronic Accessories Organizer Bag，Electronic Organizer Travel Universal Cable Organizer Electronic Accessories Cases for Cable，Charger，Phone，USB，SD Card，Business Travel Gadget Bag (Black),,,
https://m.media-amazon.com/images/I/71iUEzNffoL._AC_UL320_.jpg,Fashion Angels DIY Scrunchie Kit - Makes 6 Neon Tie Dye Scrunchies| Includes Unicorn Design Pop-up Brush| Do It Yourself Hair Accessories Kit For Tweens and Girls 8 Years Old and Up,S$21.80,3.9 ,317
https://m.media-amazon.com/images/I/915ZZrjVJ8L._AC_UL320_.jpg,Cool MAKER 6056638 Hollywood Hair Extension Maker with 12 Customizable Extensions and Accessories| for Kids Aged 8 and up,S$38.36,4.3 ,2'035
https://m.media-amazon.com/images/I/71QsdQSsLXL._AC_UL320_.jpg,100 Packs Assorted Color Butterfly Hair Clips| Bantoye Girls Beautiful Mini Butterfly Hair Clips Hair Accessories for Girls and Women| Random Color,S$14.80,4.5 ,9'806
https://m.media-amazon.com/images/I/61sE9kdYyEL._AC_UL320_.jpg,Philips HD9950/01 Party Accessory Kit with Double Layer Rack and Basket divider for Philips Airfryer XXL models,S$46.34,4.3 ,81
https://m.media-amazon.com/images/I/51kDdC8Q+GL._AC_UL320_.jpg,Slim Hard Pouch for Nintendo Switch,S$21.90,4.3 ,240
https://m.media-amazon.com/images/I/71WgSLVSVEL._AC_UL320_.jpg,Philips Kitchen Appliances Pizza Master Accessory Kit for Philips Airfryer XXL Models| Black| HD9953/00,S$60.13,4.3 ,32
https://m.media-amazon.com/images/I/71zIt5Gt3wL._AC_UL320_.jpg,Oculus Quest 2 Carrying Case for Lightweight| Portable Protection - VR,S$96.24,4.7 ,11'010
https://m.media-amazon.com/images/I/61v-qf67cAL._AC_UL320_.jpg,Steering Wheel Controller for Nintendo Switch (2 Pack) by TalkWorks | Racing Games Accessories Joy Con Controller Grip for Mario Kart| Black,S$13.02,4.4 ,3'755
https://m.media-amazon.com/images/I/61YvXAFdpnL._AC_UL320_.jpg,Grip Kit for Nintendo Switch Joy Con Controller|ShowTop Nintendo Switch Accessories Joy Con Grip-Blue and Red (2 Packs),,,
https://m.media-amazon.com/images/I/81IvaDNdQ8L._AC_UL320_.jpg,Wireless Controller for PS-4| BRHE Replacement Remote Gamepad Gaming Accessories Joystick Touch Pad/Built-in Speaker with Type-C Cable for Playstation-4/Pro/Slim/PC (Pink),S$54.93,4.4 ,180
https://m.media-amazon.com/images/I/61oRORaIc6L._AC_UL320_.jpg,KIWI design Head Strap Accessories| Elite Strap for Enhanced Support and Comfort in VR Compatible with Quest 2,S$85.47,4.8 ,4'802
https://m.media-amazon.com/images/I/81TuXyNL0mL._AC_UL320_.jpg,[2 Pack] Leg Strap Compatible with Switch OLED Model & for Nintendo Switch Ring Fit Adventure| for Joy Cons Controller Game Accessories| Adjustable Elastic Strap| Two Size for Adults and Children,S$34.10,4.5 ,574
https://m.media-amazon.com/images/I/514oAKnAYGL._AC_UL320_.jpg,Nintendo Mario Tennis Aces (HACPALERA)| Nintendo Switch,S$79.90,4.7 ,4'136
https://m.media-amazon.com/images/I/81CInh6zc2L._AC_UL320_.jpg,Carnival Games Nintendo Switch,,,
https://m.media-amazon.com/images/I/51Dcr5v511S._AC_UL320_.jpg,Playseat® Challenge Black,S$582.33,4.6 ,3'927
https://m.media-amazon.com/images/I/81BvoMAfkmL._AC_UL320_.jpg,FILA Accessories Boxing Gloves for Men & Women - Kickboxing| Heavy Bag Punching Mitts| MMA| Muay Thai| Sparring Pro Training Equipment (10| 12| 14| 16| 18 oz),S$41.26,4.6 ,123
https://m.media-amazon.com/images/I/512TTjfy3LL._AC_UL320_.jpg,GoPro AKTAC-001 Sports Kit Accessories Bundle| Black,S$100.00,4.7 ,321
https://m.media-amazon.com/images/I/11sM9YUI+IL._AC_UL320_.jpg,KOBO - ACCESSORIES Clara HD eReader SleepCover Case with Stand| 6"| Black|N249-AC-BK-E-PU,S$49.00,4.7 ,149
https://m.media-amazon.com/images/I/61CJrrUbnZL._AC_UL320_.jpg,GoPro AHWBM-002 Camera Accessory Mount Hand And Wrist Strap| Black,S$79.31,4.6 ,398
https://m.media-amazon.com/images/I/71VskXELIhL._AC_UL320_.jpg,Canon Accessories Canon Extension Grip Eg-E1(Bk),S$57.63,4.7 ,114
https://m.media-amazon.com/images/I/71OU0qvmxVL._AC_UL320_.jpg,Celestron 21024-ACC FirstScope Accessory Kit (Black),S$41.11,4.5 ,1'982
https://m.media-amazon.com/images/I/61B3q8EKZxL._AC_UL320_.jpg,Garmin 010-12741-04 Quickfit 26 Watch Band - Coyote Tan - Accessory Band for Fenix 5X Plus/Fenix 5X,S$70.42,4.7 ,194
https://m.media-amazon.com/images/I/718QBI5WTLL._AC_UL320_.jpg,Garmin vívofit jr 2| Accessory Band Only| MARVEL Spider-Man| Red,S$46.25,4.4 ,1'421
https://m.media-amazon.com/images/I/71EZ9WyxztL._AC_UL320_.jpg,RemiLore: Lost Girl in the Lands of Lore - Nintendo Switch,S$103.54,4.3 ,226
https://m.media-amazon.com/images/I/71-gBQuzt7L._AC_UL320_.jpg,FitStill 60M Waterproof Case for GoPro Hero 10 Black / Hero 9 Black| Protective Underwater Dive Housing Shell with Bracket Accessories for Go Pro Hero10 Hero9 Action Camera,S$29.73,4.6 ,804
https://m.media-amazon.com/images/I/61goSZiPsaL._AC_UL320_.jpg,GoPro AJPTC-001 Tempered Glass Lens + Screen Protectors (HERO8 Black) - Official Accessory,S$26.92,4.6 ,382
https://m.media-amazon.com/images/I/71ebfDQ3r6L._AC_UL320_.jpg,Fellowes Laptop Dual-Display Arm Accessory (8044101)| Black,S$56.93,4.2 ,10
https://m.media-amazon.com/images/I/81Cv5kVuUuL._AC_UL320_.jpg,Shure MV88+ Video Kit MOTIV Video Kit Digital Stereo Condenser Microphone and Accessories for Smartphones| Black,S$350.55,4.4 ,873
https://m.media-amazon.com/images/I/51-IaSGsL2L._AC_UL320_.jpg,FitStill 60M Waterproof Case for GoPro Hero 8 Black| Protective Underwater Dive Housing Shell with Bracket Accessories for Go Pro Hero8 Action Camera,S$28.74,4.6 ,431
https://m.media-amazon.com/images/I/612vGaK9MgL._AC_UL320_.jpg,GoPro The Handler (Floating Hand Grip),S$45.00,4.7 ,255
https://m.media-amazon.com/images/I/61f1xNHL21L._AC_UL320_.jpg,Havit RGB Headphones Stand with 3.5mm AUX and 2 USB Ports| Headphone Holder for Gamers Gaming PC Accessories Desk,S$29.99,4.5 ,8'725
https://m.media-amazon.com/images/I/51Kl0xKgwLS._AC_UL320_.jpg,ROARINGWILD Guitar Strap Leather Guitar Universal Strap Adjustable Guitar Strap Guitar Musical Instrument Accessories,,,
https://m.media-amazon.com/images/I/71caoe6i0qL._AC_UL320_.jpg,Dremel EZ725 All-Purpose Accessory Storage Kit| 70-Piece,S$65.94,4.7 ,831
https://m.media-amazon.com/images/I/71E6hWi0P+L._AC_UL320_.jpg,GoPro Protective Housing (HERO9 Black)|ADDIV-001,S$75.00,4.8 ,749
https://m.media-amazon.com/images/I/91XppR5umQL._AC_UL320_.jpg,Dremel 710-08 All-Purpose Rotary Accessory Kit| 160-Piece,S$46.74,4.8 ,3'260
https://m.media-amazon.com/images/I/71Z4vup68PL._AC_UL320_.jpg,ProCase Accessories Bag Organizer| Universal Electronics Travel Gadgets Carrying Case Pouch for Charger USB Cables SD Memory Cards Earphone Flash Hard Drive -Grey,S$16.99,4.6 ,694
https://m.media-amazon.com/images/I/81K9E7l3kfL._AC_UL320_.jpg,BLACK+DECKER BDA91109 Combination Accessory Set| 109-Piece,S$38.39,4.7 ,9'162
https://m.media-amazon.com/images/I/811ptIY+BSL._AC_UL320_.jpg,Zeikos Deluxe Padded Soft Medium Camera Case,S$17.99,4.3 ,14
https://m.media-amazon.com/images/I/81QEdTlWh7L._AC_UL320_.jpg,Ohuhu 31-Pcs Bbq Tool Set| Grill Accessories Set Heavy Duty Stainless Steel| Barbecue Grill Utensils With Aluminium Case| Grilling Tools With Barbecue Claws Set For Men Birthday Christmas,S$49.99,4.6 ,772
https://m.media-amazon.com/images/I/61E3JcnKvCL._AC_UL320_.jpg,Rottweiler Grandma Rottie Dog Mom Funny Mother´s Day Notebook: Rottweiler Notebook Journal - Blank Wide Ruled Paper - Funny Rottweilers Accessories ... - Rottie Dog Gifts for Women| Girls and Kids,,,
https://m.media-amazon.com/images/I/81n3db8YE+L._AC_UL320_.jpg,Sweet Home Collection Bathroom Accessories Collection Unique Decorative Beautiful Designs Bath Décor| 4 Piece Set| Parker,S$50.78,4.4 ,1'517
https://m.media-amazon.com/images/I/81CoJUXR-cL._AC_UL320_.jpg,Mumba Dockable Case for Nintendo Switch OLED 2021| [Blade Series] TPU Grip Protective Cover Accessories Compatible with Nintendo Switch OLED 7 Inch and Joy-Con Controller (Black),S$39.00,4.5 ,811
https://m.media-amazon.com/images/I/61B9RihsZlL._AC_UL320_.jpg,Carrying Case for Nintendo Switch| 6 in 1 Black Protective Hard Portable Travel Carry Case Shell Pouch with 2 Pack Screen Protector for Nintendo Switch Console & Accessories,S$23.99,5.0 ,1
https://m.media-amazon.com/images/I/91a9i39nX4L._AC_UL320_.jpg,Lux Accessories Set (3pc) July 4th American Flag Print Hair Elastics and Ties Ponytails,,,
https://m.media-amazon.com/images/I/61hcItMO5CL._AC_UL320_.jpg,Wireless Switch Pro Controller for Nintendo Switch/Lite/OLED| Wireless Pro Controller with Headphone Jack| Support Wake-Up Turbo Dual Vibration 6-Axis| Sakura Pink,S$49.99,4.6 ,1'138
https://m.media-amazon.com/images/I/714Bku2+68L._AC_UL320_.jpg,Disney Frozen 50 Pc Hair Accessories Bundle ~ Frozen Hair Kit with Frozen Hair Brush| Hair Clips| Mirror| and More Plus Frozen Stickers (Frozen Accessories),S$28.95,5.0 ,1
https://m.media-amazon.com/images/I/61lmWjezACL._AC_UL320_.jpg,[Updated Version] SUNTA Leather Face Cover Replacement for Oculus Quest 2| VR Facial Interface & Comfortable PU Leather Foam Face Pad & Anti-Leakage Nose Pad & Lens Protect Cover Accessories Set,S$32.77,3.9 ,224
https://m.media-amazon.com/images/I/71TkzO7ANhL._AC_UL320_.jpg,Pearls Hair Clips|28 Pcs Pearls Hair Barrettes Acrylic Resin Sweet Handmade bobby pins Hairpin Headwear Hair Accessories Headwear for Women and Girls,S$18.66,4.6 ,1'159
https://m.media-amazon.com/images/I/81Sq+0tYDVL._AC_UL320_.jpg,Accessory Innovations Backpack School Bag for Kids,S$38.66,4.7 ,113
https://m.media-amazon.com/images/I/71CeaeiTEeL._AC_UL320_.jpg,InterDesign Clarity Cosmetic Palette Organizer with Drawer for Vanity Or Cabinet to Hold Makeup Beauty Products Hair Accessories – 3 Compartments| Clear| Navy| Palette,,,
https://m.media-amazon.com/images/I/51IClRZGLbL._AC_UL320_.jpg,HAMMOCK ACCESSORY ORG LARGE BLACK,S$33.29,4.6 ,300
https://m.media-amazon.com/images/I/81HW+ltTvNL._AC_UL320_.jpg,Townley Girl Disney Frozen 2 Hair Accessory Kit for Girls| Ages 3+ (20 pieces),,,
https://m.media-amazon.com/images/I/81OBRe3dD4L._AC_UL320_.jpg,Learning Resources Create-a-Space Storage Mini Center - Blue| Classroom Craft Keeper| Maker Space| Small Space Storage| Teacher Organizer| Home School Accessories| 4 Piece Set,S$21.75,4.2 ,20
https://m.media-amazon.com/images/I/711-h-Kzt3L._AC_UL320_.jpg,QTMY Rhinestone Crystal Wide Headbands Knot Turban Fashion Vintage Hairband Elastic Hair Hoops Hair Accessories for Women Girls|Purple (White),S$32.20,4.6 ,364
https://m.media-amazon.com/images/I/91OOfF2OmnL._AC_UL320_.jpg,Set of 2pcs Gift Wrapping Paper Storage Box 40" Inches Long & Holiday Accessories Storeage & Waterproof Wraping Storage Bag - Slim Underbed Wrapping Paper Storage Container,S$61.36,4.5 ,513
https://m.media-amazon.com/images/I/61TcvAfx+OL._AC_UL320_.jpg,Aakarshana Women's Hair Accessories Indian Bollywood Style Wedding And Festive Hair Flowers Medium Red,,,
https://m.media-amazon.com/images/I/61OrRwRyxCL._AC_UL320_.jpg,QualGear PRB-717-Wht Ceiling Mount Projector Accessory,S$54.53,4.5 ,2'255
https://m.media-amazon.com/images/I/81eWIAmGH7L._AC_UL320_.jpg,Taylor Seville Originals 16046 Small Magic Clip Sewing and Quilting Clips 12-pc - Quilting Supplies and Notions - Sewing Accessories and Supplies Blue/Green,S$23.55,4.4 ,258
https://m.media-amazon.com/images/I/71ZhwY4Y9yL._AC_UL320_.jpg,Melissa & Doug 9304 Play Kitchen Accessories Set| 22 Pieces,S$50.30,4.8 ,2'478
https://m.media-amazon.com/images/I/71BFkqBZ9+L._AC_UL320_.jpg,Garmin HRM Dual Running Accessory,S$109.00,4.4 ,179
https://m.media-amazon.com/images/I/81Lmtt88TjL._AC_UL320_.jpg,BLACK+DECKER Auto Vacuum Accessory Set for BDH1200PVAV (PVAVKIT),S$42.86,4.4 ,17'034
https://m.media-amazon.com/images/I/71rHSZcpvoL._AC_UL320_.jpg,Jabra 14207-40 Evolve 75 Charging Stand Only - Provides Easy and Convenient Charging and Storage| Authentic Office Headset Accessory Black,S$51.78,4.5 ,151
https://m.media-amazon.com/images/I/719rKGtQhKL._AC_UL320_.jpg,STOGA Wireless Controller for Nintendo Switch| Panda Switch Pro Controller with Switch Lite/PC/Switch OLED| Wireless Switch Controller with Turbo/Dual Vibration/NFC Wake-Up| Kawaii Accessories-Black,S$48.99,4.6 ,95
https://m.media-amazon.com/images/I/81bfsXdKDqL._AC_UL320_.jpg,Petunia Pickle Bottom Breast Pump Bag | Breast Pump Bag with Cooler | Perfect for Storage of Breast Pump Parts and 4 Bottles | Breast Pump Accessories Bag | Breast Pump Kit | Neo Geo,S$86.30,4.7 ,8
https://m.media-amazon.com/images/I/51sWX9nddmL._AC_UL320_.jpg,Oculus Quest 2 Elite Strap for Enhanced Support and Comfort in VR,S$73.98,4.4 ,10'685
https://m.media-amazon.com/images/I/81rj84RGseL._AC_UL320_.jpg,Manhattan Toy Wee Baby Stella Travel Time Carrier Baby Doll Accessories Set for 12" Dolls,S$29.30,4.6 ,4'279
https://m.media-amazon.com/images/I/61wQJmiv3lL._AC_UL320_.jpg,Spigen Compatible for Nintendo Switch Case Rugged Armor - Black,S$14.99,4.7 ,694
https://m.media-amazon.com/images/I/71sNtfhv0qL._AC_UL320_.jpg,Joovy Toy Room² Doll Playard| Doll Accessory| Doll Furniture| Pink Dot,S$60.73,4.4 ,498
https://m.media-amazon.com/images/I/71QZ-yDPXAL._AC_UL320_.jpg,AolsteCell Anti-dust Travel Storage Handbag Protective Case for Switch Ring Con|Portable Carrying Switch Ringcon Case for Ring fit Adventure Accessories,,,
https://m.media-amazon.com/images/I/61Z4xj6VhSL._AC_UL320_.jpg,Pearhead Baby Photo Album| Babybook Keepsake Book for New and Expecting Parents| Baby Boy Accessory| Blue,S$30.53,4.7 ,2'621
https://m.media-amazon.com/images/I/71V0xN2NCJS._AC_UL320_.jpg,OAPRIRE Universal Dual Controller Holder for PS4 PS5 Xbox ONE Switch| Controller Stand Gaming Accessories| Build Your Game Fortresses (Crystal Black),S$44.86,4.8 ,327
https://m.media-amazon.com/images/I/41O1+o-OG8L._AC_UL320_.jpg,Baby Jogger Child Tray| City Mini GT2,S$80.94,4.4 ,910
https://m.media-amazon.com/images/I/81Gb7B6sZ-L._AC_UL320_.jpg,21mm Flange Maymom Pump Parts for Spectra S2 Spectra S1 Spectra 9 Plus Breastpump Not Original Spectra Pump Parts Replace Spectra S2 Accessories and Spectra S1 Plus Accessories| Spectra Small Flange,S$56.99,4.8 ,93
https://m.media-amazon.com/images/I/61hcItMO5CL._AC_UL320_.jpg,Wireless Switch Pro Controller for Nintendo Switch/Lite/OLED| Wireless Pro Controller with Headphone Jack| Support Wake-Up Turbo Dual Vibration 6-Axis| Sakura Pink,S$49.99,4.6 ,1'138
https://m.media-amazon.com/images/I/61lmWjezACL._AC_UL320_.jpg,[Updated Version] SUNTA Leather Face Cover Replacement for Oculus Quest 2| VR Facial Interface & Comfortable PU Leather Foam Face Pad & Anti-Leakage Nose Pad & Lens Protect Cover Accessories Set,S$32.77,3.9 ,224
https://m.media-amazon.com/images/I/81Sq+0tYDVL._AC_UL320_.jpg,Accessory Innovations Backpack School Bag for Kids,S$38.66,4.7 ,113
https://m.media-amazon.com/images/I/71caoe6i0qL._AC_UL320_.jpg,Dremel EZ725 All-Purpose Accessory Storage Kit| 70-Piece,S$65.94,4.7 ,831
https://m.media-amazon.com/images/I/81Lmtt88TjL._AC_UL320_.jpg,BLACK+DECKER Auto Vacuum Accessory Set for BDH1200PVAV (PVAVKIT),S$42.86,4.4 ,17'034
https://m.media-amazon.com/images/I/81+fvjKB1-L._AC_UL320_.jpg,Learning Resources Botley The Coding Robot Accessory Set| Multicolor| 38 Pieces,S$28.39,4.5 ,761
https://m.media-amazon.com/images/I/817vwsV5txS._AC_UL320_.jpg,Bratz 20 Yearz Special Anniversary Edition Original Fashion Doll Jade with Accessories and Holographic Poster | Collectible Doll | For Collector Adults and Kids of All Ages,,,
https://m.media-amazon.com/images/I/81wEJ1vJfiS._AC_UL320_.jpg,Beistle 2 Piece Durable Jointed Cardstock Paper Palm Trees Luau Birthday Decorations Summer Tropical Party Accessory Beach Theme Hawaiian Photo Prop Background,S$34.41,4.2 ,670
https://m.media-amazon.com/images/I/716o25k7d0L._AC_UL320_.jpg,Barbie Club Chelsea Doll and Carnival Playset| 6-inch Blonde Wearing Fashion and Accessories| with Ferris Wheel| Bumper Cars| Puppy and More| Gift for 3 to 7 Year Olds,,,
https://m.media-amazon.com/images/I/719rKGtQhKL._AC_UL320_.jpg,STOGA Wireless Controller for Nintendo Switch| Panda Switch Pro Controller with Switch Lite/PC/Switch OLED| Wireless Switch Controller with Turbo/Dual Vibration/NFC Wake-Up| Kawaii Accessories-Black,S$48.99,4.6 ,95
https://m.media-amazon.com/images/I/51sWX9nddmL._AC_UL320_.jpg,Oculus Quest 2 Elite Strap for Enhanced Support and Comfort in VR,S$73.98,4.4 ,10'685
https://m.media-amazon.com/images/I/61wQJmiv3lL._AC_UL320_.jpg,Spigen Compatible for Nintendo Switch Case Rugged Armor - Black,S$14.99,4.7 ,694
https://m.media-amazon.com/images/I/71QZ-yDPXAL._AC_UL320_.jpg,AolsteCell Anti-dust Travel Storage Handbag Protective Case for Switch Ring Con|Portable Carrying Switch Ringcon Case for Ring fit Adventure Accessories,,,
https://m.media-amazon.com/images/I/71V0xN2NCJS._AC_UL320_.jpg,OAPRIRE Universal Dual Controller Holder for PS4 PS5 Xbox ONE Switch| Controller Stand Gaming Accessories| Build Your Game Fortresses (Crystal Black),S$44.86,4.8 ,327
https://m.media-amazon.com/images/I/71SirZVLgmL._AC_UL320_.jpg,Nilight 50026R Digital Tire Inflator Pressure Gauge|250 PSI Air Chuck and Compressor Accessories Heavy Duty with Rubber Hose and Quick Connect Coupler for 0.1 Display Resolution|2 Year Warranty,S$31.10,4.6 ,6'851
https://m.media-amazon.com/images/I/81xEgcKdpVL._AC_UL320_.jpg,Kuryakyn 7147 Motorcycle Accent Accessory: Lower Fork Covers for 2014-19 Harley-Davidson Touring Motorcycles| Gloss Black| 1 Pair,S$170.63,4.5 ,39
https://m.media-amazon.com/images/I/91GWZUQ1vEL._AC_UL320_.jpg,Oakley Mens Kitchen Sink,S$263.95,4.7 ,520
https://m.media-amazon.com/images/I/61-NANUhIiL._AC_UL320_.jpg,Leather Watch Roll Travel Case for 3 Watches| Storage Organizer & Display| Watch accessory| Luxury Velvet interior for Anti-scratching (Blue+Wine Red),,,
https://m.media-amazon.com/images/I/81dJvHraNWL._AC_UL320_.jpg,Packing Cubes Luggage Bags Organizer Durable Travel Accessories With Clothing Label| 8 set - Grey/Rose| One_Size,S$53.96,4.7 ,140
https://m.media-amazon.com/images/I/71h0DzXg9jL._AC_UL320_.jpg,ReliBeauty Girls Sequin Princess Costume Long Sleeve Dress up,S$69.23,4.8 ,3'827
https://m.media-amazon.com/images/I/71QeL7NVgYL._AC_UL320_.jpg,BAGAIL 8 Set Packing Cubes Luggage Packing Organizers for Travel Accessories| Wine Red| Small,S$37.69,4.5 ,2'056
https://m.media-amazon.com/images/I/511SPRMzTaS._AC_UL320_.jpg,Kawaii Backpack for Girls Women with Pin Bear Accessories Cute College High School Backpack Laptop Bookbags,S$44.69,3.5 ,44
https://m.media-amazon.com/images/I/61SwgRjavBL._AC_UL320_.jpg,SalesOne LLC Marvel Studios Shang-Chi and The Legend of The Ten Rings Green Pendant Necklace Authentic Prop Replica| Cosplay Costume Accessories | MCU Superhero Comic Book Gifts and Collectibles,S$52.00,4.3 ,13
https://m.media-amazon.com/images/I/6130Z9PMtbL._AC_UL320_.jpg,Adult Nordic Viking Helmet with Horns Braids Barbarian Warrior Costume Accessory Gold,S$31.14,4.4 ,95
https://m.media-amazon.com/images/I/81nWqjxrtJL._AC_UL320_.jpg,Hanging Travel Toiletry Bag for Women with Hook|Large Makeup Organizer with 21 Compartments|Water-resistant Travel Cosmetic Bag for Bathroom Accessories| Full Sized Container| Toiletries (Navy Blue),S$41.48,4.8 ,121
https://m.media-amazon.com/images/I/41hotfDfScL._AC_UL320_.jpg,Twelve South Backpack for M1 iMac,S$61.58,4.9 ,11
https://m.media-amazon.com/images/I/81e40O6wvxL._AC_UL320_.jpg,Celestron PowerSeeker Accessory Kit Telescope,S$46.33,4.3 ,8'548
https://m.media-amazon.com/images/I/717Uqv49qUL._AC_UL320_.jpg,FitStill Double Lock Waterproof Housing for GoPro Hero 2018/7/6/5 Black| Protective 45m Underwater Dive Case Shell with Bracket Accessories for Go Pro Hero7 Hero6 Hero5 Action Camera,S$33.24,4.4 ,2'052
https://m.media-amazon.com/images/I/717vFfxSA8L._AC_UL320_.jpg,Garmin 010-12666-15 vívofit jr 2 Accessory Band| Disney Princess Purple| Adjustable Band,S$31.03,4.4 ,1'421
https://m.media-amazon.com/images/I/51P7bIs9S2L._AC_UL320_.jpg,Elgato Solid Arm Auxiliary Holding arm for Cameras| Lights and More| Multi Mount Accessory| black (10AAG9901),S$49.00,4.8 ,249
https://m.media-amazon.com/images/I/61EcBbntU9L._AC_UL320_.jpg,OtterBox Utility Series Latch II Case with Accessory Bag for 10-Inch Tablets,S$43.37,4.6 ,766
https://m.media-amazon.com/images/I/61sjmcW6MNL._AC_UL320_.jpg,XM3 Earpads Replacement Ear Pads Cushion Parts Compatible with Sony WH-1000XM3 Wireless Noise Cancelling Headphones| Accessories Made of Memory Foam (Silver),S$17.99,3.8 ,20
https://m.media-amazon.com/images/I/81rRq7ltslL._AC_UL320_.jpg,ProCase Hard Travel Case for Oculus Quest 2/Oculus Quest VR Gaming Headset and Controllers Accessories Shockproof EVA Hard Shell Carrying Case Storage Bag –Grey,S$51.99,4.7 ,1'235
https://m.media-amazon.com/images/I/91K3Vq4VihL._AC_UL320_.jpg,Cocoon CPG36BK GRID-IT!® Wrap 10 Tablet Accessory Organizer (Black),S$27.99,4.2 ,172
https://m.media-amazon.com/images/I/71czjQ1ORCL._AC_UL320_.jpg,ProCase DJI OM 5 Case| Hard EVA Water-Resistant Carrying Case for DJI OM5 Smartphone Gimbal Stabilizer and Accessories -Black,S$19.99,4.5 ,32
https://m.media-amazon.com/images/I/71+OQysjHnL._AC_UL320_.jpg,ProCase Travel Case for New AirPods Max (Case Only)| Hardshell Headphone Case with Mesh Pocket| Alternative Carrying Case for AirPods Max and Other Accessories -Black,S$38.99,4.7 ,281
https://m.media-amazon.com/images/I/61ZHHVmm3SL._AC_UL320_.jpg,Spigen Running Phone Armband Compatible for Most Cell Phone & Accessories A700 - Camo,S$17.99,3.9 ,56
https://m.media-amazon.com/images/I/71kid8z96ZL._AC_UL320_.jpg,NOV8Tech Mini USB C Hub Dongle Adapter for MacBook Air Pro 13 15 inch M1 2022/2021-2018 Silver MacBook Air USB adapter| 4K HDMI| 100W PD| 40Gbps TB3 5K 60Hz| USB-C| 2 USB 3.0 and SD/Micro Card Readers,S$49.99,4.2 ,334
