https://m.media-amazon.com/images/I/61dZtjANTaS._AC_UL320_.jpg,KIWI design Controller Grips Cover Accessories for Oculus Quest 2 (Parents) (Black+White),S$50.45,4.6 ,172
https://m.media-amazon.com/images/I/71kw0RENMVL._AC_UL320_.jpg,Bike Phone Holder| Motorcycle Phone Mount - Lamicall Bicycle Handlebar Cell Phone Clamp| Scooter Phone Clip for Phone 11 Pro Max| S9 and 4.7"- 6.8" Cellphone,S$24.99,4.6 ,12'156
https://m.media-amazon.com/images/I/61iUV78O0oL._AC_UL320_.jpg,Celestron 94308 Observers Accessory Kit (Black),S$153.83,4.5 ,103
https://m.media-amazon.com/images/I/71M4nhCcnpL._AC_UL320_.jpg,UGREEN Electronics Organizer Travel Cable Organizer Gadgets Bag Accessories For Usb Cable Cord Usb Flash Drive Sd Card Hard Drive Power Bank Ipad Mini Tablet,S$22.99,4.6 ,3'282
https://m.media-amazon.com/images/I/61wVBaDQARL._AC_UL320_.jpg,Fitbit Versa Family Accessory Band| Official Fitbit Product| Classic| Black| Small,S$20.28,4.4 ,103
https://m.media-amazon.com/images/I/71Ma4u2CoNL._AC_UL320_.jpg,Sisma Travel Cords Organizer Universal Small Electronic Accessories Carrying Bag for Cables Chargers Adapter Leads Memory Cards - Gray 1680D fabrics,S$23.60,4.7 ,2'004
https://m.media-amazon.com/images/I/813oF-FY01L._AC_UL320_.jpg,Fujifilm INSTAX Mini Instant Film Twin Pack| White| 20 Sheets,S$23.90,4.8 ,15'276
https://m.media-amazon.com/images/I/71Zj7PsRmcL._AC_UL320_.jpg,VCUTECH Mini 2 Waterproof Hard Carrying Case Compatible with DJI Mini 2 Drone/Fly More Combo & Drone Accessories| Mavic Mini 2 Accessories| Anti-Crash with Full Protection (Mini 2| Black),S$75.80,4.8 ,374
https://m.media-amazon.com/images/I/61K+TAs6zVL._AC_UL320_.jpg,[2021 Version] LENCENT Car FM Transmitter| Wireless Bluetooth 5.0 Radio Adapter Car Kit| PD3.0 Type C 20W+QC3.0 Car Fast Charger| Hands Free Calling| Bass Lossless Hi-Fi Sound Support U Disk,S$33.99,4.3 ,3'992
https://m.media-amazon.com/images/I/81JMwLWJVSS._AC_UL320_.jpg,Electronic Accessories Organizer Bag，Electronic Organizer Travel Universal Cable Organizer Electronic Accessories Cases for Cable，Charger，Phone，USB，SD Card，Business Travel Gadget Bag (Grey),,,
https://m.media-amazon.com/images/I/81sTMB1g-FL._AC_UL320_.jpg,ProCase MacBook Air 13 Inch/MacBook Pro 13 Inch Laptop Sleeve| Felt Sleeve Case Cover with an Extra Accessory Organizer for MacBook Air 13 / Pro 13 / iPad Pro 12.9 –Black,S$19.99,4.6 ,675
https://m.media-amazon.com/images/I/41d23h7nYkL._AC_UL320_.jpg,Spigen Compatible for Apple Watch Series 7/6/SE/5/4/3/2/1 Stand S350 - White,S$19.99,4.5 ,24'082
https://m.media-amazon.com/images/I/611yJI1nXOL._AC_UL320_.jpg,Garmin 010-12741-01 Quickfit Watch Band| Black| 26mm,S$370.09,4.0 ,30
https://m.media-amazon.com/images/I/51racTJqSVL._AC_UL320_.jpg,JHZCH 1PC Vintage Metal Frame For Purse Bag Sewing Bronze Tone With Pearl Ball Clasp Metal Kiss Clasp Lock Bag Accessories 19cm (Color : White),,,
https://m.media-amazon.com/images/I/61d6dsPmoPL._AC_UL320_.jpg,Orzly Carry Case Compatible with Nintendo Switch and New Switch OLED Console - Black Protective Hard Portable Travel Carry Case Shell Pouch with Pockets for Accessories and Games,S$46.08,4.7 ,44'174
https://m.media-amazon.com/images/I/61v0ECN7iXL._AC_UL320_.jpg,LENTION Split Leather Sleeve Pouch Bag| Electronic Accessories Storage Organizer Case for Laptop Charger| Wireless Mouse| Phone Charger| Power Bank| Cables and More Small Accessories (Black),S$14.99,5.0 ,1
https://m.media-amazon.com/images/I/51m4uFn3flL._AC_UL320_.jpg,Replacement Band for Garmin Forerunner 35| Silicone Replacement Fitness Bands Bracelet Sport Strap Wristband Accessory with Screwdriver for Garmin Forerunner 35,S$14.51,3.9 ,96
https://m.media-amazon.com/images/I/71-gBQuzt7L._AC_UL320_.jpg,FitStill 60M Waterproof Case for GoPro Hero 10 Black / Hero 9 Black| Protective Underwater Dive Housing Shell with Bracket Accessories for Go Pro Hero10 Hero9 Action Camera,S$29.73,4.6 ,804
https://m.media-amazon.com/images/I/61Gpabyx6KL._AC_UL320_.jpg,EEweca 2-Pack Clip for Fitbit Inspire or Inspire HR Holder Accessory| Black,S$16.90,4.5 ,1'649
https://m.media-amazon.com/images/I/91M1I7weVSL._AC_UL320_.jpg,Dremel Versa Accessory PC367-3 Power Scrubber Kitchen Scour Pad – Perfect for Cleaning Pots & Pans| Oven Racks| and Grill Grates,S$13.79,4.7 ,268
https://m.media-amazon.com/images/I/61eGDpfVkfL._AC_UL320_.jpg,Tuuli Accessories Back Massage Muscle Roller Tool Massager Wooden 47.2 inches (15.7 x 2.8 inches Rolling Surface),S$26.90,4.5 ,807
https://m.media-amazon.com/images/I/71vxYrCvoUS._AC_UL320_.jpg,Disney's Frozen 2 Talking Elsa and Friends| Elsa Doll with Over 20 Sounds and Phrases| Fashion Doll Accessories| Toy for Kids 3 and Up,,,
https://m.media-amazon.com/images/I/71wdrjq7ZoL._AC_UL320_.jpg,Creativity for Kids Designed by You Hair Bow Maker - Create 5 Hair Accessories,S$23.19,4.5 ,232
https://m.media-amazon.com/images/I/51EMtxsTN4L._AC_UL320_.jpg,Glass Spray Bottle| Bontip Amber Glass Spray Bottle Set & Accessories for Non-toxic Window Cleaners Aromatherapy Facial hydration Watering Flowers Hair Care (2 Pack/16oz) (Amber),S$19.17,4.5 ,4'781
https://m.media-amazon.com/images/I/61oHCVWaR8L._AC_UL320_.jpg,Deluxe Adult Child Toy Space Helmet Astronaut Costume Accessory| One Size White,S$67.06,4.5 ,113
https://m.media-amazon.com/images/I/61mH+25TN3L._AC_UL320_.jpg,8 Pieces Plastic Headbands Inner Teeth Comb Non Slip Hard Headband Accessories for Women Girls(ph8p_02),S$16.35,5.0 ,4
https://m.media-amazon.com/images/I/71C4oplARqL._AC_UL320_.jpg,Packing Cubes for Travel| 9 Set Luggage Organizers with Shoe Bag| Electronics Bag| Cosmetics Bag| Compression Cells| Accessories Bags Made With Lightweight Waterproof Fabric (9 PCS - Grey),S$35.85,4.4 ,1'019
https://m.media-amazon.com/images/I/71sZ9wTDE4L._AC_UL320_.jpg,Women's I Love The 80's T-Shirt 80s Outfit Accessories,S$44.50,4.1 ,41
https://m.media-amazon.com/images/I/91qCyKgsPtL._AC_UL320_.jpg,tomtoc Laptop Shoulder Bag for 14-inch MacBook Pro 2021 A2442| 13.5-14.4 Inch Surface Laptop Studio 2021/4/3| Surface Book 3/2/1| 360 Protective Case Fit Asus VivoBook/ZenBook 14| Accessory Bag,S$31.79,4.7 ,3'849
https://m.media-amazon.com/images/I/71fBUqbcmiL._AC_UL320_.jpg,TOBATOBA Headbands for Women Boho African Headbands Wide Headbands for Women Fashion Headband Stretchy Turban Headbands for Daily Use Sport Yoga Beach Hair Accessories for Women and Girls Pack of 4,S$20.04,4.4 ,39
https://m.media-amazon.com/images/I/61zCqXQapnL._AC_UL320_.jpg,mDesign Hair Straightener Holder – Metal Stand for Holding Hair Brushes and Styling Accessories – Ideal as Hair Dryer Stand – Matte Black,S$30.80,4.7 ,6'863
https://m.media-amazon.com/images/I/61Fib-1G8QL._AC_UL320_.jpg,Oboe Accessories Soft Oboe Reed Good Quality for Beginning Oboist for Concert for Music Lovers,S$29.45,2.0 ,1
https://m.media-amazon.com/images/I/71ZTy47ca0L._AC_UL320_.jpg,Accessory: Elektrik,,,
https://m.media-amazon.com/images/I/61JiIfR4AzL._AC_UL320_.jpg,UGREEN Switch Carrying Case for Nintendo Switch Lite Portable Hard Shell Travel Case Pouch Protective Cover Bag with 9 Game Cartridges Card Slots for Nintendo Switch Console Pro Controller Accessories,S$18.99,4.7 ,415
https://m.media-amazon.com/images/I/61rIvmE5hhL._AC_UL320_.jpg,PowerA Joy-Con Comfort Grip for Nintendo Switch - Animal Crossing| Game Controller| Gamepad| Nintendo Switch Lite - Nintendo Switch,S$26.81,4.8 ,2'035
https://m.media-amazon.com/images/I/718sziC6sML._AC_UL320_.jpg,Game Controller Wall Mount Stand Holder (2 Pack) for XBOX ONE SWITCH PS4 STEAM PC NINTENDO| Universal Gamepad Accessories - No screws| Stick on| Black By Brainwavz (V2 - Improved Adhesion),,,
https://m.media-amazon.com/images/I/51DIemSe6TL._AC_UL320_.jpg,CNBEYOUNG Touch Controller Grip Cover Compatible with Meta/Oculus Quest 2| Anti-Throw Handle Sleeve Oculus Quest 2 Accessories with Nylon Adjustable Wrist Knuckle Strap(White),S$24.99,4.4 ,1'765
https://m.media-amazon.com/images/I/718Jl+0WIJL._AC_UL320_.jpg,Fitbit FB166ABWTS Versa| Classic Accessory Band| White| Small,S$49.90,4.8 ,100
https://m.media-amazon.com/images/I/813JYnCLh-L._AC_UL320_.jpg,UGREEN Travel Case Gadget Bag Small Portable Electronics Accessories Organiser Travel Carry Hard Case Cable Tidy Storage Box Pouch With Double Layer Double Zipper Snap Hook Carrying Strap,S$24.99,4.6 ,3'285
https://m.media-amazon.com/images/I/413qePDQPSL._AC_UL320_.jpg,Arlo Accessory VMA5400 - Rechargeable Battery | Compatible with Arlo Ultra and Pro3 Camera,S$79.00,4.4 ,2'325
https://m.media-amazon.com/images/I/81WpqjLJA0L._AC_UL320_.jpg,ProCase Hard Travel Tech Organizer Case Bag for Electronics Accessories Charger Cord Portable External Hard Drive USB Cables Power Bank SD Memory Cards Earphone Flash Drive -Navy,S$16.99,4.5 ,58
https://m.media-amazon.com/images/I/71dn3dZLMeL._AC_UL320_.jpg,BOVKE Graphing Calculator Carrying Case Replacement for Texas Instruments TI-Nspire CX CAS/CX II CAS Color Graphing Calculator and More - Extra Mesh Pocket for USB Cables and Other Accessories| Black,S$24.99,4.7 ,1'080
https://m.media-amazon.com/images/I/81RTLD-S7xL._AC_UL320_.jpg,Schwinn Bike Phone Mount Accessories,S$14.86,4.0 ,270
https://m.media-amazon.com/images/I/61ysga4lHcL._AC_UL320_.jpg,Arlo Accessory - Table/Ceiling Mount | Compatible with Arlo| Pro| Pro 2 | (VMA1100),S$39.00,4.5 ,358
https://m.media-amazon.com/images/I/616PZwf0RbL._AC_UL320_.jpg,3 in 1 Tripod and Action GoPro Mount Stand Bracket for DJI Osmo Pocket for DJI Pocket 2| Action Cam Mount with Tripod Mount and Screw| for DJI Osmo Pocket Accessories Kit Tripod and GoPro,S$25.69,4.4 ,246
https://m.media-amazon.com/images/I/718+xHIwnSS._AC_UL320_.jpg,Electronic Accessories Organizer Bag，Electronic Organizer Travel Universal Cable Organizer Electronic Accessories Cases for Cable，Charger，Phone，USB，SD Card，Business Travel Gadget Bag (Red),,,
https://m.media-amazon.com/images/I/81Fhe5S1HDS._AC_UL320_.jpg,Electronic Accessories Organizer Bag，Electronic Organizer Travel Universal Cable Organizer Electronic Accessories Cases for Cable，Charger，Phone，USB，SD Card，Business Travel Gadget Bag (Dark Blue),,,
https://m.media-amazon.com/images/I/91FG1naNkGL._AC_UL320_.jpg,tomtoc Laptop Sleeve for 12.3 Inch Microsoft Surface Pro 8/X/7+/7/6/5| 12.4-inch Surface Laptop Go| New Dell XPS 13 2021| 360° Protective Laptop Accessory Case Bag,,,
https://m.media-amazon.com/images/I/71g39e7N2vL._AC_UL320_.jpg,Travel Electronics Organizer| Waterproof Cable Organizer Bag for Electronic Accessories Double Layer Large Shockproof Cable Storage Bag for Cord| Power Bank| Tablet(Up to iPad 11 inch) - Black,S$41.79,4.6 ,735
https://m.media-amazon.com/images/I/71nHreslVRL._AC_UL320_.jpg,Oculus Quest 2 Elite Strap with Battery and Carrying Case for Enhanced Comfort and Playtime in VR,S$170.05,4.5 ,2'646
https://m.media-amazon.com/images/I/61vLzXZT54L._AC_UL320_.jpg,Garmin Quickfit 26 Watch Band - Solar Flare Orange Silicone - Accessory Band for Fenix 5X Plus/Fenix 5X,S$44.91,4.8 ,93
https://m.media-amazon.com/images/I/616oK2M8BkL._AC_UL320_.jpg,AMVR Head Back Padding| Gravity Pressure Balance Cushion Comfortable Soft TPU Pad Accessories for Oculus Quest 2 Headset (Black),S$38.03,4.6 ,941
https://m.media-amazon.com/images/I/71r3qgXiIML._AC_UL320_.jpg,tomtoc Tablet Shoulder Sleeve Bag for 12.9-inch New iPad Pro (5th/4th/3rd Gen) 2021-2018 with Magic Keyboard and Smart Keyboard Folio or Logitech Slim Folio Pro Case| Front Pocket for Accessories,S$33.59,5.0 ,2
https://m.media-amazon.com/images/I/91pr7-IEuJL._AC_UL320_.jpg,Accessory House Limited Edition Midnight Blue AHG Ear Cushions for Bose QuietComfort 35 II (QC35 II) Headphones (QC35 Dark Blue),S$16.35,4.6 ,8'050
https://m.media-amazon.com/images/I/71bRMrPIWSL._AC_UL320_.jpg,Element Case Special Ops Watch Band and Case for Apple Watch Series 7| 45mm - Olive/Black (EMT-522-260AZ-02),,,
https://m.media-amazon.com/images/I/81v6fkmpWUL._AC_UL320_.jpg,Lenovo Yoga Laptop Sleeve for 14-Inch Computer| Leather and Wool Felt| Magnetic Closure| Accessory Pocket| GX40X02932| Black,S$29.90,4.2 ,145
https://m.media-amazon.com/images/I/71nAfybQprL._AC_UL320_.jpg,BAGSMART Electronic Organizer Travel Universal Cable Organizer Electronics Accessories Cases for Cable| Charger| Phone| USB| SD Card| Black (Grey),S$42.50,4.6 ,2'945
https://m.media-amazon.com/images/I/81v6fkmpWUL._AC_UL320_.jpg,Lenovo Yoga Laptop Sleeve for 14-Inch Computer| Leather and Wool Felt| Magnetic Closure| Accessory Pocket| GX40X02932| Black,S$29.90,4.2 ,145
https://m.media-amazon.com/images/I/71nAfybQprL._AC_UL320_.jpg,BAGSMART Electronic Organizer Travel Universal Cable Organizer Electronics Accessories Cases for Cable| Charger| Phone| USB| SD Card| Black (Grey),S$42.50,4.6 ,2'945
https://m.media-amazon.com/images/I/51dNDONQOoL._AC_UL320_.jpg,Insta360 Motorcycle Accessory Bundle for ONE R| ONE X| ONE Action Camera,S$69.00,4.4 ,218
https://m.media-amazon.com/images/I/81Gxd2oVxfL._AC_UL320_.jpg,iVoler Carrying Storage Case for Nintendo Switch Model|Portable Travel All Protective Hard Messenger Bag Soft Lining 18 Games for Switch Console Pro Controller & Accessories Red+Blue,S$55.19,4.7 ,448
https://m.media-amazon.com/images/I/61jNWHPPeuS._AC_UL320_.jpg,iPad Pro USB C Hub| 7-in-1 Adapter for iPad Pro 2021 2020 2018 12.9 11 inch iPad Air 4 Docking Station with 4K HDMI| USB-C PD Charging| SD/TF Card Reader| USB 3.0| 3.5mm Headphone Jack| Accessories,S$37.99,4.3 ,730
https://m.media-amazon.com/images/I/81M5TU+AGNS._AC_UL320_.jpg,Digital Camera Case Compatible with Keculbo/ SEREE/ CEDITA/ SUNLEO/ Weton/ Lincom Tech Vlogging Camera YouTube Vlog Cameras. Travel Storage Holder for Memory Card| Batteries and Accessories (Box Only),S$25.12,4.0 ,53
https://m.media-amazon.com/images/I/91pwULedsIL._AC_UL320_.jpg,tomtoc Laptop Sleeve for 12.3 Inch Microsoft Surface Pro 8/X/7+/7/6/5| 12.4-inch Surface Laptop Go| New Dell XPS 13 2021| 360° Protective Laptop Accessory Case Bag,S$25.19,2.0 ,1
https://m.media-amazon.com/images/I/61GcVnNYr1L._AC_UL320_.jpg,Light & Motion SOLA Ball Mount Kit Sola Light Accessory,,,
https://m.media-amazon.com/images/I/81BXy0mlNXL._AC_UL320_.jpg,Skyreat Osmo Pocket 2 Case|Portable Travel Carry Bag for DJI Pocket 2 Creator Combo and Accessories,S$26.97,4.5 ,115
https://m.media-amazon.com/images/I/91ToeC3oGAL._AC_UL320_.jpg,Domke F-2 original shoulder bag 700-02S (Sand) for Canon| Nikon| Sony| Leica| Fujifilm & Olympus DSLR or Mirrorless cameras with space for multiple lenses up to 300mm and accessories,S$143.08,4.6 ,315
https://m.media-amazon.com/images/I/61+X-iRfRHL._AC_UL320_.jpg,KIWI design Fitness Facial Interface Accessories (Upgraded Version)| Face Cushion Foam Pad Replacement 2 Piece| with Customized Glasses Spacer and Lens Protector Compatible with Quest 2,S$72.27,4.5 ,1'182
https://m.media-amazon.com/images/I/71N620lXKCL._AC_UL320_.jpg,Single Computer Monitor Arm with 2 USB Ports adjustable height universal VESA mount lcd holder sit stand-up standing desk accessory organizer one screen swivel pan tilt screens black,S$52.01,4.2 ,32
https://m.media-amazon.com/images/I/71JdqbOaJQL._AC_UL320_.jpg,Carrying Case for DJI Mini 2|Hard Protective Case Travel Drone Bag Compatible with DJI Mini 2 Drone| Remote Comtroller| Battery and Other Accessories,S$29.75,4.4 ,87
https://m.media-amazon.com/images/I/61E6+MhOk+L._AC_UL320_.jpg,QualGear PRB-717-Blk Ceiling Mount Projector Accessory|Black Mount,S$18.39,4.5 ,2'255
https://m.media-amazon.com/images/I/81juiJMkhzL._AC_UL320_.jpg,ProCase Hard Travel Tech Organizer Case Bag for Electronics Accessories Charger Cord Portable External Hard Drive USB Cables Power Bank SD Memory Cards Earphone Flash Drive -Black,S$19.99,4.6 ,1'345
https://m.media-amazon.com/images/I/81dru4f9aiL._AC_UL320_.jpg,tomtoc 360 Protective Laptop Sleeve for 13-inch MacBook Air M1/A2337 A2179 2018-2021| MacBook Pro M1/A2338 A2251 A2289 2016-2021| Water-Resistant Shockproof MacBook Case Bag with Accessory Pouch,S$48.11,4.7 ,318
https://m.media-amazon.com/images/I/61yixGwxdQL._AC_UL320_.jpg,Lowepro ViewPoint CS 40 - A Soft-Sided Protective Case for a Smartphone| GoPro or 360 Camera and Accessories,S$42.78,4.7 ,834
https://m.media-amazon.com/images/I/718NVofDrCL._AC_UL320_.jpg,iOttie HLCRIO125 Easy One Touch 4 Dashboard and Windshield Car Phone Mount Holder for iPhone XS Max R 8 Plus 7 6s SE Samsung Galaxy S9 S8 Edge S7 S6 Note 9 and other Smartphone Black Large,S$28.55,3.8 ,8
https://m.media-amazon.com/images/I/81n2eS-SDuL._AC_UL320_.jpg,ProCase Carrying Case for 3D Pen| EVA Hard Storage Case with Hand Strap| Compatible with MYNT3D Professional Printing 3D Pen and Accessories,S$11.99,4.6 ,58
https://m.media-amazon.com/images/I/71Bw7ivZoHL._AC_UL320_.jpg,MOUNTDOG Action Camera Accessories Kit for GoPro Hero 10 9 8 7 6 5 4 3+ 3 Hero Session 5 Black Accessory Bundle Set for Yi AKASO Apeman SJ4000 DBPOWER WiMiUS QUMOX Campark Action Camera Accessory,S$49.40,4.4 ,4'461
https://m.media-amazon.com/images/I/6132lQzqmXL._AC_UL320_.jpg,iOttie HLCRIO171AM Easy One Touch 5 Dashboard & Windshield Car Mount Phone Holder Desk Stand for iPhone| Samsung| Moto| Huawei| Nokia| LG| Smartphones,S$42.43,4.4 ,17'779
https://m.media-amazon.com/images/I/61C8xg0FWuL._AC_UL320_.jpg,(8-Pack) RinoGear Screen Protector for Fitbit Inspire 2 Case Friendly Fitbit Inspire 2 Screen Protector Accessory Clear Film,S$18.44,4.4 ,537
https://m.media-amazon.com/images/I/71no87F-j7S._AC_UL320_.jpg,KIWI design Upgraded Controller Grips Cover Accessories Compatible with Oculus Quest 2| with Battery Opening Protector with Knuckle Straps (Black),S$60.47,4.6 ,1'987
https://m.media-amazon.com/images/I/71f7U3M8xxS._AC_UL320_.jpg,Spigen Waterproof Phone Case Pouch 2 Pack Compatible for Most Cell Phone & Accessories Aquashield| A601 - Crystal Clear,S$17.99,4.2 ,437
https://m.media-amazon.com/images/I/71tc9-pzmOS._AC_UL320_.jpg,Carrying Case for Insta360 One X2 X Camera|Large Hard Shell Bag with EVA Liner Compatible for Insta 360 Bullet Time Handle/Selfie Stick and Other Accessories,S$46.01,4.4 ,53
https://m.media-amazon.com/images/I/71JDJ-y0sRL._AC_UL320_.jpg,Waterproof Floating Hand Grip Compatible with GoPro Hero 10 9 8 7 6 5 4 3 3+ 2 1 Session Black Silver Camera Handler & Handle Mount Accessories Kit for Water Sport and Action Cameras (Orange),S$30.47,4.6 ,1'533
https://m.media-amazon.com/images/I/718MH-BbbsL._AC_UL320_.jpg,iMangoo Shockproof Carrying Case Hard Protective EVA Case Impact Resistant Travel 12000mAh Bank Pouch Bag USB Cable Organizer Earbuds Pocket Accessory Smooth Coating Zipper Wallet Rose Gold,S$30.96,4.5 ,7'725
https://m.media-amazon.com/images/I/81DGezTqb2L._AC_UL320_.jpg,JETech Electronics Accessories Organizer Hard Carrying Case with Double Zipper and Carrying Strap| Portable Travel Gadget Bag for Cables| SD Card| Charger| Hard Disk| Grey,S$11.98,4.4 ,596
https://m.media-amazon.com/images/I/81dru4f9aiL._AC_UL320_.jpg,tomtoc 360 Protective Laptop Sleeve for 16-inch MacBook Pro M1 Pro/Max A2485 A2141 2021-2019| Shockproof| Water-Resistant| Lightweight MacBook Case Bag with Organized Accessory Pouch,S$61.02,4.7 ,318
https://m.media-amazon.com/images/I/81M3w285rAL._AC_UL320_.jpg,Native Union Stow Lite Organizer – Minimalist Travel Pouch for Everyday Accessory Storage & Protection – Stores Cables| Chargers & More (Sage),S$52.55,4.5 ,264
https://m.media-amazon.com/images/I/61d6HlAXn5L._AC_UL320_.jpg,(8-Pack) RinoGear Screen Protector for Fitbit Sense Case Friendly Fitbit Sense Screen Protector Accessory Clear Film,S$20.76,4.2 ,1'803
https://m.media-amazon.com/images/I/41b9DagFtkL._AC_UL320_.jpg,Arlo Accessory VMB5000 - Smart Hub | Compatible with Ultra| PRO 2| and PRO 3 Cameras,S$279.00,4.4 ,2'325
https://m.media-amazon.com/images/I/51g3MQ+AORL._AC_UL320_.jpg,Extension Lead with USB C Port| 1 Way Outlets Power Strip with 1 USB-C and 1 USB Slots| Multi Power Plug Extension with 1M Extension Cord for Home Office Accessories Travel Essentials| 3250W 13A White,S$16.99,5.0 ,1
https://m.media-amazon.com/images/I/81dqDm5cKHL._AC_UL320_.jpg,Leebotree Instant Camera Accessories Compatible with Instax Mini 11 Instant Film Camera Include Case/Album/Wall Hang Frames/Film Frames/Border Stickers/Corner Stickers (Rainbow),S$38.66,4.8 ,624
https://m.media-amazon.com/images/I/718KMeclJgL._AC_UL320_.jpg,Sancore 2in1 Phone Armband Running Wristband Phone Holder| Detachable Running Accessories Cycling Fishing Walking Strap for iPhone 11 12 13 Pro Max Mini XS Plus| Galaxy S20 s21 Ultra S10 Note 20 10,S$22.85,4.1 ,213
https://m.media-amazon.com/images/I/81XD408tUfL._AC_UL320_.jpg,JETech Laptop Sleeve Compatible with 13.3-Inch Notebook Tablet iPad Tab| Compatible with 13" MacBook Pro and MacBook Air| Waterproof Shock Resistant Bag Case with Accessory Pocket| Grey,S$15.99,4.7 ,23'737
https://m.media-amazon.com/images/I/71rOObUC52L._AC_UL320_.jpg,Electronic Organizer Travel Cable Accessories Bag Portable Gadget Storage Cases Waterproof Universal Cord Storage Pouch for Office Home(Double Layer|Pink),S$27.47,4.6 ,970
https://m.media-amazon.com/images/I/51CZX9AGDkL._AC_UL320_.jpg,Meguiar's X2000 Water Magnet Drying Towel,S$36.50,4.6 ,11'002
https://m.media-amazon.com/images/I/61G-T3c2jrL._AC_UL320_.jpg,Kuryakyn 5788 Motorcycle Accessory: Heat Deflector Saddle Shields for 2014-19 Harley-Davidson Sportster Motorcycles| Reflective Smoke| 1 Pair,S$103.67,4.4 ,250
https://m.media-amazon.com/images/I/71XqG3JliGL._AC_UL320_.jpg,Classic Accessories Storigami Water-Resistant 80 x 26 Inch Chaise Lounge Cushion| Antique Beige,S$217.46,3.6 ,50
https://m.media-amazon.com/images/I/71GIV0wxcmL._AC_UL320_.jpg,Nyko Thin Case - Dockable Protective Case with Tempered Glass Screen Protector for Nintendo Switch - Red/Blue,S$15.62,4.5 ,2'736
https://m.media-amazon.com/images/I/61l-VcCDKEL._AC_UL320_.jpg,Japanese Switchpreme - Padded Dock Sock Cover Made for Nintendo Switch - OLED Compatible | Accessories| Dock + Screen Protection,,,
https://m.media-amazon.com/images/I/61JAMr0KMvL._AC_UL320_.jpg,UGREEN Protective Case Compatible for Nintendo Switch 2017| Dockable Grip Case Cover Protector Accessories Anti-Scratch Shock-Absorption,S$14.99,4.0 ,35
https://m.media-amazon.com/images/I/71wqEjy9XsL._AC_UL320_.jpg,2 packs AolsteCell Wrist straps for Nintendo Switch Just Dance 2022 2021 2020|Wristbands for Joycon Controller|Zumba Burn It Up| Switch Accessories-Adults and Kids,,,
https://m.media-amazon.com/images/I/51QOroccOZL._AC_UL320_.jpg,PowerA Joy-Con Comfort Grips for Nintendo Switch – Black,S$8.19,4.6 ,23'806
https://m.media-amazon.com/images/I/81Sxdp0JBLL._AC_UL320_.jpg,Nintendo Switch Console| Animal Crossing: New Horizon Special Edition,S$439.00,4.7 ,72'802
https://m.media-amazon.com/images/I/71i60os2-hL._AC_UL320_.jpg,Black Microfiber Screen Cleaner Made for the Nintendo Switch - OLED Compatible | Accessories,,,
https://m.media-amazon.com/images/I/71OkTEUGvKL._AC_UL320_.jpg,HORI Compact Playstand for Nintendo Switch Officially Licensed by Nintendo,S$24.36,4.7 ,10'913
https://m.media-amazon.com/images/I/71tcdM-LBoL._AC_UL320_.jpg,AolsteCell 2 Pack Tennis Racket for Nintendo Switch Oled|Tennis Racket for Switch Joycon Controller|Accessories for Nintendo Switch Game Mario Tennis Aces (Black and Black)- Only Use for Swing Mode,,,
https://m.media-amazon.com/images/I/714nmmxjyBL._AC_UL320_.jpg,Cute Cat Paw Carrying Case Compatible with Nintendo Switch - 21 Game Card Slot & Removable Shoulder Strap - Portable Hardshell Storage Bag for Switch Console Controller & Accessories,S$59.18,4.7 ,74
https://m.media-amazon.com/images/I/618Nrb7G9SL._AC_UL320_.jpg,omarando PS5 Carrying Case| Console Case Compatible Playstation 5 and PS5 Digital Edition|PS5 Games| Included PS5 Controller Protection Box|Travel Bag for PS5 Console & Accessories (Black-Blue),S$59.99,4.5 ,2
https://m.media-amazon.com/images/I/81XBaniklYL._AC_UL320_.jpg,Padded Dock Sock Cover Made for Nintendo Switch - OLED Compatible | Accessories| Dock + Screen Protection (Triforce Gold / Black),,,
https://m.media-amazon.com/images/I/91GWQ5+4GYL._AC_UL320_.jpg,Padded Dock Sock Cover Made for Nintendo Switch - OLED Compatible | Accessories| Dock + Screen Protection,,,
https://m.media-amazon.com/images/I/51qPoQ9LNoS._AC_UL320_.jpg,Switch Lite Case for Nintendo Switch Lite Protective Case Cover Skin Accessories - Grip Cover with Built-in PC Screen Protector - Split Cover TPU+PC Case with Anti-Scratch and Shock-Absorption - Black,,,
https://m.media-amazon.com/images/I/713TFIPR7EL._AC_UL320_.jpg,KontrolFreek FPS Freek Galaxy Purple for PlayStation 4 (PS4) and PlayStation 5 (PS5) | Performance Thumbsticks | 1 High-Rise| 1 Mid-Rise | Purple,S$25.00,4.6 ,17'667
https://m.media-amazon.com/images/I/61Ts5zx9+EL._AC_UL320_.jpg,[2 Pack Updated]AolsteCell Golf Clubs Compatible with Nintendo Switch Joy-con| Golf Grip for Mario Golf Super Rush Switch Game| Controller Handle Grips Accessories with Wrist Strap(Black+Black),,,
https://m.media-amazon.com/images/I/81P+UF6o4ZL._AC_UL320_.jpg,Black and White Plaid - Padded Dock Sock Cover Made for Nintendo Switch - OLED Compatible | Accessories| Dock + Screen Protection,,,
https://m.media-amazon.com/images/I/71BvgEvO0cL._AC_UL320_.jpg,AolsteCell Anti-slip Switch Wristbands for Just Dance 2022 2021 2020 and Zumba Burn It Up| Widened Adjustable Wrist Straps for Switch Controller Joy cons Right/Left|Ideal Nintendo Switch Accessories,S$20.00,4.0 ,1
https://m.media-amazon.com/images/I/71mjGkllAoL._AC_UL320_.jpg,omarando PS5 Carrying Case| Console Case Compatible Playstation 5 and PS5 Digital Edition|PS5 Games| Included PS5 Controller Protection Box|Travel Bag for PS5 Console & Accessories (Black-Green),S$59.99,5.0 ,2
https://m.media-amazon.com/images/I/61un5i68GCL._AC_UL320_.jpg,omarando PS5 Carrying Case| Console Case Compatible Playstation 5 and PS5 Digital Edition|PS5 Games| Included PS5 Controller Protection Box|Travel Bag for PS5 Console & Accessories (Black-Red),S$59.99,2.0 ,1
